=== Hardware Sensor Simulation Test ===
Category: Hardware Integration
Description: Comprehensive sensor simulation on correct ports with realistic data rates and error injection
Success: True
Duration: 6.19s
Exit Code: 0

=== STDOUT ===
05:17:17 [[32mINFO[0m] AppLogger: === Multi-Sensor Recording System Logging Initialized ===
05:17:17 [[32mINFO[0m] AppLogger: Log level: INFO
05:17:17 [[32mINFO[0m] AppLogger: Log directory: /home/runner/work/bucika_gsr/bucika_gsr/PythonApp/logs
05:17:17 [[32mINFO[0m] AppLogger: Console output: True
05:17:17 [[32mINFO[0m] AppLogger: File output: True
05:17:17 [[32mINFO[0m] AppLogger: Structured logging: True
05:17:17 [[33mWARNING[0m] __main__: OpenCV not available - will simulate camera detection
05:17:17 [[33mWARNING[0m] __main__: NumPy not available - will use basic calculations
05:17:17 [[36mDEBUG[0m] asyncio: Using selector: EpollSelector
05:17:17 [[32mINFO[0m] __main__: Starting Hardware Sensor Simulation Test...
05:17:17 [[32mINFO[0m] __main__: HardwareSensorTest initialized in /tmp/sensor_test_hz29tsem
05:17:17 [[32mINFO[0m] __main__: ================================================================================
05:17:17 [[32mINFO[0m] __main__: HARDWARE SENSOR SIMULATION TEST - START
05:17:17 [[32mINFO[0m] __main__: ================================================================================
05:17:17 [[32mINFO[0m] __main__: === Detecting All Sensor Types ===
05:17:17 [[32mINFO[0m] __main__: Detecting USB cameras...
05:17:17 [[32mINFO[0m] __main__: Created simulated USB camera 1
05:17:17 [[32mINFO[0m] __main__: Created simulated USB camera 2
05:17:17 [[32mINFO[0m] __main__: USB cameras: 0 real, 2 simulated
05:17:17 [[32mINFO[0m] __main__: Scanning for Bluetooth devices...
05:17:17 [[32mINFO[0m] __main__: Bluetooth scan completed: 2 devices found
05:17:17 [[32mINFO[0m] __main__: Bluetooth devices: 0 real, 2 simulated
05:17:17 [[32mINFO[0m] __main__: Detecting thermal camera...
05:17:17 [[32mINFO[0m] __main__: Thermal camera simulation initialized
05:17:17 [[32mINFO[0m] __main__: Thermal camera: simulated
05:17:17 [[32mINFO[0m] __main__: Setting up network sensor simulators...
05:17:17 [[32mINFO[0m] __main__: Network devices: 2 simulated
05:17:17 [[32mINFO[0m] __main__: === Testing Sensor Port Assignments ===
05:17:17 [[36mDEBUG[0m] __main__: ✅ USB camera port: /dev/video10
05:17:17 [[36mDEBUG[0m] __main__: ✅ Bluetooth address: 00:06:66:AA:BB:01
05:17:17 [[32mINFO[0m] __main__: Thermal camera simulation initialized
05:17:17 [[36mDEBUG[0m] __main__: ✅ Thermal camera: usb_c
05:17:17 [[36mDEBUG[0m] __main__: ✅ Network ports: 8080+
05:17:17 [[36mDEBUG[0m] __main__: ✅ Preview stream ports: 8081-8082
05:17:17 [[32mINFO[0m] __main__: ✅ Port assignment test: 5/5 correct (100.0%)
05:17:17 [[32mINFO[0m] __main__: === Testing Sensor Synchronization ===
05:17:17 [[32mINFO[0m] __main__: ✅ Synchronization test: good (max drift: 3.30ms)
05:17:17 [[32mINFO[0m] __main__: 
--- Running Sensor Detection Test ---
05:17:17 [[32mINFO[0m] __main__: Sensor Detection: ✅ PASS
05:17:17 [[32mINFO[0m] __main__: 
--- Running USB Camera Streams Test ---
05:17:17 [[32mINFO[0m] __main__: === Testing USB Camera Streams ===
05:17:17 [[32mINFO[0m] __main__: Started camera stream: Simulated USB Camera 1
05:17:17 [[32mINFO[0m] __main__: Started camera stream: Simulated USB Camera 2
05:17:17 [[36mDEBUG[0m] __main__: Collected frame from Simulated USB Camera 1
05:17:17 [[36mDEBUG[0m] __main__: Collected frame from Simulated USB Camera 2
05:17:17 [[36mDEBUG[0m] __main__: Collected frame from Simulated USB Camera 1
05:17:17 [[36mDEBUG[0m] __main__: Collected frame from Simulated USB Camera 2
05:17:17 [[36mDEBUG[0m] __main__: Collected frame from Simulated USB Camera 1
05:17:17 [[36mDEBUG[0m] __main__: Collected frame from Simulated USB Camera 2
05:17:17 [[36mDEBUG[0m] __main__: Collected frame from Simulated USB Camera 1
05:17:17 [[36mDEBUG[0m] __main__: Collected frame from Simulated USB Camera 2
05:17:17 [[36mDEBUG[0m] __main__: Collected frame from Simulated USB Camera 1
05:17:17 [[36mDEBUG[0m] __main__: Collected frame from Simulated USB Camera 2
05:17:17 [[36mDEBUG[0m] __main__: Collected frame from Simulated USB Camera 1
05:17:17 [[36mDEBUG[0m] __main__: Collected frame from Simulated USB Camera 2
05:17:17 [[36mDEBUG[0m] __main__: Collected frame from Simulated USB Camera 1
05:17:17 [[36mDEBUG[0m] __main__: Collected frame from Simulated USB Camera 2
05:17:17 [[36mDEBUG[0m] __main__: Collected frame from Simulated USB Camera 1
05:17:17 [[36mDEBUG[0m] __main__: Collected frame from Simulated USB Camera 2
05:17:17 [[36mDEBUG[0m] __main__: Collected frame from Simulated USB Camera 1
05:17:17 [[36mDEBUG[0m] __main__: Collected frame from Simulated USB Camera 2
05:17:17 [[36mDEBUG[0m] __main__: Collected frame from Simulated USB Camera 1
05:17:17 [[36mDEBUG[0m] __main__: Collected frame from Simulated USB Camera 2
05:17:18 [[32mINFO[0m] __main__: Stopped camera stream: Simulated USB Camera 1
05:17:18 [[32mINFO[0m] __main__: Stopped camera stream: Simulated USB Camera 2
05:17:18 [[32mINFO[0m] __main__: ✅ USB camera test: 20 frames collected from 2 cameras
05:17:18 [[32mINFO[0m] __main__: USB Camera Streams: ✅ PASS
05:17:18 [[32mINFO[0m] __main__: 
--- Running Bluetooth Sensors Test ---
05:17:18 [[32mINFO[0m] __main__: === Testing Bluetooth Sensors ===
05:17:18 [[32mINFO[0m] __main__: Connected to Shimmer: Shimmer3-GSR-001
05:17:18 [[32mINFO[0m] __main__: Connected to Shimmer: Shimmer3-GSR-002
05:17:18 [[32mINFO[0m] __main__: Started GSR recording: Shimmer3-GSR-001
05:17:18 [[32mINFO[0m] __main__: Started GSR recording: Shimmer3-GSR-002
05:17:18 [[36mDEBUG[0m] __main__: GSR sample: 152.5 kΩ
05:17:18 [[36mDEBUG[0m] __main__: GSR sample: 152.5 kΩ
05:17:18 [[36mDEBUG[0m] __main__: GSR sample: 152.4 kΩ
05:17:18 [[36mDEBUG[0m] __main__: GSR sample: 152.4 kΩ
05:17:18 [[36mDEBUG[0m] __main__: GSR sample: 152.4 kΩ
05:17:18 [[36mDEBUG[0m] __main__: GSR sample: 152.4 kΩ
05:17:18 [[36mDEBUG[0m] __main__: GSR sample: 152.3 kΩ
05:17:18 [[36mDEBUG[0m] __main__: GSR sample: 152.3 kΩ
05:17:18 [[36mDEBUG[0m] __main__: GSR sample: 152.3 kΩ
05:17:18 [[36mDEBUG[0m] __main__: GSR sample: 152.3 kΩ
05:17:18 [[36mDEBUG[0m] __main__: GSR sample: 152.2 kΩ
05:17:18 [[36mDEBUG[0m] __main__: GSR sample: 152.2 kΩ
05:17:18 [[36mDEBUG[0m] __main__: GSR sample: 152.2 kΩ
05:17:18 [[36mDEBUG[0m] __main__: GSR sample: 152.2 kΩ
05:17:18 [[36mDEBUG[0m] __main__: GSR sample: 152.2 kΩ
05:17:18 [[36mDEBUG[0m] __main__: GSR sample: 152.2 kΩ
05:17:18 [[36mDEBUG[0m] __main__: GSR sample: 152.1 kΩ
05:17:18 [[36mDEBUG[0m] __main__: GSR sample: 152.1 kΩ
05:17:18 [[36mDEBUG[0m] __main__: GSR sample: 152.1 kΩ
05:17:18 [[36mDEBUG[0m] __main__: GSR sample: 152.1 kΩ
05:17:18 [[36mDEBUG[0m] __main__: GSR sample: 152.0 kΩ
05:17:18 [[36mDEBUG[0m] __main__: GSR sample: 152.0 kΩ
05:17:18 [[36mDEBUG[0m] __main__: GSR sample: 151.9 kΩ
05:17:18 [[36mDEBUG[0m] __main__: GSR sample: 151.9 kΩ
05:17:18 [[36mDEBUG[0m] __main__: GSR sample: 151.9 kΩ
05:17:18 [[36mDEBUG[0m] __main__: GSR sample: 151.9 kΩ
05:17:18 [[36mDEBUG[0m] __main__: GSR sample: 151.8 kΩ
05:17:18 [[36mDEBUG[0m] __main__: GSR sample: 151.8 kΩ
05:17:18 [[36mDEBUG[0m] __main__: GSR sample: 151.8 kΩ
05:17:18 [[36mDEBUG[0m] __main__: GSR sample: 151.8 kΩ
05:17:18 [[36mDEBUG[0m] __main__: GSR sample: 151.8 kΩ
05:17:18 [[36mDEBUG[0m] __main__: GSR sample: 151.8 kΩ
05:17:18 [[36mDEBUG[0m] __main__: GSR sample: 151.7 kΩ
05:17:18 [[36mDEBUG[0m] __main__: GSR sample: 151.7 kΩ
05:17:18 [[36mDEBUG[0m] __main__: GSR sample: 151.7 kΩ
05:17:18 [[36mDEBUG[0m] __main__: GSR sample: 151.7 kΩ
05:17:18 [[36mDEBUG[0m] __main__: GSR sample: 151.6 kΩ
05:17:18 [[36mDEBUG[0m] __main__: GSR sample: 151.6 kΩ
05:17:18 [[36mDEBUG[0m] __main__: GSR sample: 151.6 kΩ
05:17:18 [[36mDEBUG[0m] __main__: GSR sample: 151.6 kΩ
05:17:18 [[36mDEBUG[0m] __main__: GSR sample: 151.5 kΩ
05:17:18 [[36mDEBUG[0m] __main__: GSR sample: 151.5 kΩ
05:17:18 [[36mDEBUG[0m] __main__: GSR sample: 151.4 kΩ
05:17:18 [[36mDEBUG[0m] __main__: GSR sample: 151.4 kΩ
05:17:18 [[36mDEBUG[0m] __main__: GSR sample: 151.4 kΩ
05:17:18 [[36mDEBUG[0m] __main__: GSR sample: 151.4 kΩ
05:17:18 [[36mDEBUG[0m] __main__: GSR sample: 151.3 kΩ
05:17:18 [[36mDEBUG[0m] __main__: GSR sample: 151.3 kΩ
05:17:18 [[36mDEBUG[0m] __main__: GSR sample: 151.3 kΩ
05:17:18 [[36mDEBUG[0m] __main__: GSR sample: 151.3 kΩ
05:17:18 [[36mDEBUG[0m] __main__: GSR sample: 151.2 kΩ
05:17:18 [[36mDEBUG[0m] __main__: GSR sample: 151.2 kΩ
05:17:18 [[36mDEBUG[0m] __main__: GSR sample: 151.2 kΩ
05:17:18 [[36mDEBUG[0m] __main__: GSR sample: 151.2 kΩ
05:17:18 [[36mDEBUG[0m] __main__: GSR sample: 151.2 kΩ
05:17:18 [[36mDEBUG[0m] __main__: GSR sample: 151.2 kΩ
05:17:18 [[36mDEBUG[0m] __main__: GSR sample: 151.1 kΩ
05:17:18 [[36mDEBUG[0m] __main__: GSR sample: 151.1 kΩ
05:17:18 [[36mDEBUG[0m] __main__: GSR sample: 151.1 kΩ
05:17:18 [[36mDEBUG[0m] __main__: GSR sample: 151.1 kΩ
05:17:18 [[36mDEBUG[0m] __main__: GSR sample: 151.0 kΩ
05:17:18 [[36mDEBUG[0m] __main__: GSR sample: 151.0 kΩ
05:17:18 [[36mDEBUG[0m] __main__: GSR sample: 150.9 kΩ
05:17:18 [[36mDEBUG[0m] __main__: GSR sample: 150.9 kΩ
05:17:18 [[36mDEBUG[0m] __main__: GSR sample: 150.9 kΩ
05:17:18 [[36mDEBUG[0m] __main__: GSR sample: 150.9 kΩ
05:17:18 [[36mDEBUG[0m] __main__: GSR sample: 150.8 kΩ
05:17:18 [[36mDEBUG[0m] __main__: GSR sample: 150.8 kΩ
05:17:18 [[36mDEBUG[0m] __main__: GSR sample: 150.8 kΩ
05:17:18 [[36mDEBUG[0m] __main__: GSR sample: 150.8 kΩ
05:17:18 [[36mDEBUG[0m] __main__: GSR sample: 150.8 kΩ
05:17:18 [[36mDEBUG[0m] __main__: GSR sample: 150.8 kΩ
05:17:18 [[36mDEBUG[0m] __main__: GSR sample: 150.7 kΩ
05:17:18 [[36mDEBUG[0m] __main__: GSR sample: 150.7 kΩ
05:17:18 [[36mDEBUG[0m] __main__: GSR sample: 150.7 kΩ
05:17:18 [[36mDEBUG[0m] __main__: GSR sample: 150.7 kΩ
05:17:18 [[36mDEBUG[0m] __main__: GSR sample: 150.6 kΩ
05:17:18 [[36mDEBUG[0m] __main__: GSR sample: 150.6 kΩ
05:17:18 [[36mDEBUG[0m] __main__: GSR sample: 150.6 kΩ
05:17:18 [[36mDEBUG[0m] __main__: GSR sample: 150.6 kΩ
05:17:18 [[36mDEBUG[0m] __main__: GSR sample: 150.5 kΩ
05:17:18 [[36mDEBUG[0m] __main__: GSR sample: 150.5 kΩ
05:17:18 [[36mDEBUG[0m] __main__: GSR sample: 150.4 kΩ
05:17:18 [[36mDEBUG[0m] __main__: GSR sample: 150.4 kΩ
05:17:18 [[36mDEBUG[0m] __main__: GSR sample: 150.4 kΩ
05:17:18 [[36mDEBUG[0m] __main__: GSR sample: 150.4 kΩ
05:17:18 [[36mDEBUG[0m] __main__: GSR sample: 150.3 kΩ
05:17:18 [[36mDEBUG[0m] __main__: GSR sample: 150.3 kΩ
05:17:18 [[36mDEBUG[0m] __main__: GSR sample: 150.3 kΩ
05:17:18 [[36mDEBUG[0m] __main__: GSR sample: 150.3 kΩ
05:17:18 [[36mDEBUG[0m] __main__: GSR sample: 150.2 kΩ
05:17:18 [[36mDEBUG[0m] __main__: GSR sample: 150.2 kΩ
05:17:18 [[36mDEBUG[0m] __main__: GSR sample: 150.2 kΩ
05:17:18 [[36mDEBUG[0m] __main__: GSR sample: 150.2 kΩ
05:17:19 [[36mDEBUG[0m] __main__: GSR sample: 150.2 kΩ
05:17:19 [[36mDEBUG[0m] __main__: GSR sample: 150.2 kΩ
05:17:19 [[36mDEBUG[0m] __main__: GSR sample: 150.1 kΩ
05:17:19 [[36mDEBUG[0m] __main__: GSR sample: 150.1 kΩ
05:17:19 [[36mDEBUG[0m] __main__: GSR sample: 150.1 kΩ
05:17:19 [[36mDEBUG[0m] __main__: GSR sample: 150.1 kΩ
05:17:19 [[32mINFO[0m] __main__: Stopped GSR recording: Shimmer3-GSR-001
05:17:19 [[32mINFO[0m] __main__: Disconnected from Shimmer: Shimmer3-GSR-001
05:17:19 [[32mINFO[0m] __main__: Stopped GSR recording: Shimmer3-GSR-002
05:17:19 [[32mINFO[0m] __main__: Disconnected from Shimmer: Shimmer3-GSR-002
05:17:19 [[32mINFO[0m] __main__: ✅ Bluetooth sensor test: 100 GSR samples from 2 devices
05:17:19 [[32mINFO[0m] __main__: Bluetooth Sensors: ✅ PASS
05:17:19 [[32mINFO[0m] __main__: 
--- Running Thermal Camera Test ---
05:17:19 [[32mINFO[0m] __main__: === Testing Thermal Camera ===
05:17:19 [[32mINFO[0m] __main__: Connected to thermal camera (simulated)
05:17:19 [[32mINFO[0m] __main__: Started thermal recording
05:17:19 [[36mDEBUG[0m] __main__: Thermal frame: avg=25.0°C, range=20.0-40.0°C
05:17:19 [[36mDEBUG[0m] __main__: Thermal frame: avg=25.0°C, range=20.0-40.0°C
05:17:19 [[36mDEBUG[0m] __main__: Thermal frame: avg=25.0°C, range=20.0-40.0°C
05:17:19 [[36mDEBUG[0m] __main__: Thermal frame: avg=25.0°C, range=20.0-40.0°C
05:17:19 [[36mDEBUG[0m] __main__: Thermal frame: avg=25.0°C, range=20.0-40.0°C
05:17:19 [[36mDEBUG[0m] __main__: Thermal frame: avg=25.0°C, range=20.0-40.0°C
05:17:19 [[36mDEBUG[0m] __main__: Thermal frame: avg=25.0°C, range=20.0-40.0°C
05:17:19 [[36mDEBUG[0m] __main__: Thermal frame: avg=25.0°C, range=20.0-40.0°C
05:17:19 [[36mDEBUG[0m] __main__: Thermal frame: avg=25.0°C, range=20.0-40.0°C
05:17:19 [[36mDEBUG[0m] __main__: Thermal frame: avg=25.0°C, range=20.0-40.0°C
05:17:20 [[36mDEBUG[0m] __main__: Thermal frame: avg=25.0°C, range=20.0-40.0°C
05:17:20 [[36mDEBUG[0m] __main__: Thermal frame: avg=25.0°C, range=20.0-40.0°C
05:17:20 [[36mDEBUG[0m] __main__: Thermal frame: avg=25.0°C, range=20.0-40.0°C
05:17:20 [[36mDEBUG[0m] __main__: Thermal frame: avg=25.0°C, range=20.0-40.0°C
05:17:20 [[36mDEBUG[0m] __main__: Thermal frame: avg=25.0°C, range=20.0-40.0°C
05:17:20 [[36mDEBUG[0m] __main__: Thermal frame: avg=25.0°C, range=20.0-40.0°C
05:17:20 [[36mDEBUG[0m] __main__: Thermal frame: avg=25.0°C, range=20.0-40.0°C
05:17:20 [[36mDEBUG[0m] __main__: Thermal frame: avg=25.0°C, range=20.0-40.0°C
05:17:20 [[36mDEBUG[0m] __main__: Thermal frame: avg=25.0°C, range=20.0-40.0°C
05:17:20 [[36mDEBUG[0m] __main__: Thermal frame: avg=25.0°C, range=20.0-40.0°C
05:17:21 [[32mINFO[0m] __main__: Stopped thermal recording
05:17:21 [[32mINFO[0m] __main__: Disconnected thermal camera
05:17:21 [[32mINFO[0m] __main__: ✅ Thermal camera test: 20 frames, temp range 25.0-25.0°C (avg 25.0°C)
05:17:21 [[32mINFO[0m] __main__: Thermal Camera: ✅ PASS
05:17:21 [[32mINFO[0m] __main__: 
--- Running Network Sensors Test ---
05:17:21 [[32mINFO[0m] __main__: === Testing Network Sensors ===
05:17:21 [[32mINFO[0m] __main__: Network sensors started for phone_1 on port 8080
05:17:21 [[32mINFO[0m] __main__: Network sensors started for phone_2 on port 8090
05:17:21 [[32mINFO[0m] __main__: Started 2 network sensor services
05:17:21 [[32mINFO[0m] __main__: Testing camera sensors...
05:17:21 [[36mDEBUG[0m] __main__: Network camera sample from phone_1_camera
05:17:21 [[36mDEBUG[0m] __main__: Network camera sample from phone_2_camera
05:17:21 [[36mDEBUG[0m] __main__: Network camera sample from phone_1_camera
05:17:21 [[36mDEBUG[0m] __main__: Network camera sample from phone_2_camera
05:17:21 [[36mDEBUG[0m] __main__: Network camera sample from phone_1_camera
05:17:21 [[36mDEBUG[0m] __main__: Network camera sample from phone_2_camera
05:17:21 [[36mDEBUG[0m] __main__: Network camera sample from phone_1_camera
05:17:21 [[36mDEBUG[0m] __main__: Network camera sample from phone_2_camera
05:17:21 [[36mDEBUG[0m] __main__: Network camera sample from phone_1_camera
05:17:21 [[36mDEBUG[0m] __main__: Network camera sample from phone_2_camera
05:17:21 [[36mDEBUG[0m] __main__: Network camera sample from phone_1_camera
05:17:21 [[36mDEBUG[0m] __main__: Network camera sample from phone_2_camera
05:17:21 [[36mDEBUG[0m] __main__: Network camera sample from phone_1_camera
05:17:21 [[36mDEBUG[0m] __main__: Network camera sample from phone_2_camera
05:17:21 [[36mDEBUG[0m] __main__: Network camera sample from phone_1_camera
05:17:21 [[36mDEBUG[0m] __main__: Network camera sample from phone_2_camera
05:17:21 [[36mDEBUG[0m] __main__: Network camera sample from phone_1_camera
05:17:21 [[36mDEBUG[0m] __main__: Network camera sample from phone_2_camera
05:17:21 [[36mDEBUG[0m] __main__: Network camera sample from phone_1_camera
05:17:21 [[36mDEBUG[0m] __main__: Network camera sample from phone_2_camera
05:17:21 [[32mINFO[0m] __main__:   camera: 20 samples collected
05:17:21 [[32mINFO[0m] __main__: Testing accelerometer sensors...
05:17:21 [[36mDEBUG[0m] __main__: Network accelerometer sample from phone_1_accelerometer
05:17:21 [[36mDEBUG[0m] __main__: Network accelerometer sample from phone_2_accelerometer
05:17:21 [[36mDEBUG[0m] __main__: Network accelerometer sample from phone_1_accelerometer
05:17:21 [[36mDEBUG[0m] __main__: Network accelerometer sample from phone_2_accelerometer
05:17:21 [[36mDEBUG[0m] __main__: Network accelerometer sample from phone_1_accelerometer
05:17:21 [[36mDEBUG[0m] __main__: Network accelerometer sample from phone_2_accelerometer
05:17:21 [[36mDEBUG[0m] __main__: Network accelerometer sample from phone_1_accelerometer
05:17:21 [[36mDEBUG[0m] __main__: Network accelerometer sample from phone_2_accelerometer
05:17:21 [[36mDEBUG[0m] __main__: Network accelerometer sample from phone_1_accelerometer
05:17:21 [[36mDEBUG[0m] __main__: Network accelerometer sample from phone_2_accelerometer
05:17:21 [[36mDEBUG[0m] __main__: Network accelerometer sample from phone_1_accelerometer
05:17:21 [[36mDEBUG[0m] __main__: Network accelerometer sample from phone_2_accelerometer
05:17:21 [[36mDEBUG[0m] __main__: Network accelerometer sample from phone_1_accelerometer
05:17:21 [[36mDEBUG[0m] __main__: Network accelerometer sample from phone_2_accelerometer
05:17:21 [[36mDEBUG[0m] __main__: Network accelerometer sample from phone_1_accelerometer
05:17:21 [[36mDEBUG[0m] __main__: Network accelerometer sample from phone_2_accelerometer
05:17:21 [[36mDEBUG[0m] __main__: Network accelerometer sample from phone_1_accelerometer
05:17:21 [[36mDEBUG[0m] __main__: Network accelerometer sample from phone_2_accelerometer
05:17:22 [[36mDEBUG[0m] __main__: Network accelerometer sample from phone_1_accelerometer
05:17:22 [[36mDEBUG[0m] __main__: Network accelerometer sample from phone_2_accelerometer
05:17:22 [[32mINFO[0m] __main__:   accelerometer: 20 samples collected
05:17:22 [[32mINFO[0m] __main__: Testing gyroscope sensors...
05:17:22 [[36mDEBUG[0m] __main__: Network gyroscope sample from phone_1_gyroscope
05:17:22 [[36mDEBUG[0m] __main__: Network gyroscope sample from phone_2_gyroscope
05:17:22 [[36mDEBUG[0m] __main__: Network gyroscope sample from phone_1_gyroscope
05:17:22 [[36mDEBUG[0m] __main__: Network gyroscope sample from phone_2_gyroscope
05:17:22 [[36mDEBUG[0m] __main__: Network gyroscope sample from phone_1_gyroscope
05:17:22 [[36mDEBUG[0m] __main__: Network gyroscope sample from phone_2_gyroscope
05:17:22 [[36mDEBUG[0m] __main__: Network gyroscope sample from phone_1_gyroscope
05:17:22 [[36mDEBUG[0m] __main__: Network gyroscope sample from phone_2_gyroscope
05:17:22 [[36mDEBUG[0m] __main__: Network gyroscope sample from phone_1_gyroscope
05:17:22 [[36mDEBUG[0m] __main__: Network gyroscope sample from phone_2_gyroscope
05:17:22 [[36mDEBUG[0m] __main__: Network gyroscope sample from phone_1_gyroscope
05:17:22 [[36mDEBUG[0m] __main__: Network gyroscope sample from phone_2_gyroscope
05:17:22 [[36mDEBUG[0m] __main__: Network gyroscope sample from phone_1_gyroscope
05:17:22 [[36mDEBUG[0m] __main__: Network gyroscope sample from phone_2_gyroscope
05:17:22 [[36mDEBUG[0m] __main__: Network gyroscope sample from phone_1_gyroscope
05:17:22 [[36mDEBUG[0m] __main__: Network gyroscope sample from phone_2_gyroscope
05:17:22 [[36mDEBUG[0m] __main__: Network gyroscope sample from phone_1_gyroscope
05:17:22 [[36mDEBUG[0m] __main__: Network gyroscope sample from phone_2_gyroscope
05:17:22 [[36mDEBUG[0m] __main__: Network gyroscope sample from phone_1_gyroscope
05:17:22 [[36mDEBUG[0m] __main__: Network gyroscope sample from phone_2_gyroscope
05:17:22 [[32mINFO[0m] __main__:   gyroscope: 20 samples collected
05:17:22 [[32mINFO[0m] __main__: Testing magnetometer sensors...
05:17:22 [[36mDEBUG[0m] __main__: Network magnetometer sample from phone_1_magnetometer
05:17:22 [[36mDEBUG[0m] __main__: Network magnetometer sample from phone_2_magnetometer
05:17:22 [[36mDEBUG[0m] __main__: Network magnetometer sample from phone_1_magnetometer
05:17:22 [[36mDEBUG[0m] __main__: Network magnetometer sample from phone_2_magnetometer
05:17:22 [[36mDEBUG[0m] __main__: Network magnetometer sample from phone_1_magnetometer
05:17:22 [[36mDEBUG[0m] __main__: Network magnetometer sample from phone_2_magnetometer
05:17:22 [[36mDEBUG[0m] __main__: Network magnetometer sample from phone_1_magnetometer
05:17:22 [[36mDEBUG[0m] __main__: Network magnetometer sample from phone_2_magnetometer
05:17:22 [[36mDEBUG[0m] __main__: Network magnetometer sample from phone_1_magnetometer
05:17:22 [[36mDEBUG[0m] __main__: Network magnetometer sample from phone_2_magnetometer
05:17:22 [[36mDEBUG[0m] __main__: Network magnetometer sample from phone_1_magnetometer
05:17:22 [[36mDEBUG[0m] __main__: Network magnetometer sample from phone_2_magnetometer
05:17:22 [[36mDEBUG[0m] __main__: Network magnetometer sample from phone_1_magnetometer
05:17:22 [[36mDEBUG[0m] __main__: Network magnetometer sample from phone_2_magnetometer
05:17:22 [[36mDEBUG[0m] __main__: Network magnetometer sample from phone_1_magnetometer
05:17:22 [[36mDEBUG[0m] __main__: Network magnetometer sample from phone_2_magnetometer
05:17:23 [[36mDEBUG[0m] __main__: Network magnetometer sample from phone_1_magnetometer
05:17:23 [[36mDEBUG[0m] __main__: Network magnetometer sample from phone_2_magnetometer
05:17:23 [[36mDEBUG[0m] __main__: Network magnetometer sample from phone_1_magnetometer
05:17:23 [[36mDEBUG[0m] __main__: Network magnetometer sample from phone_2_magnetometer
05:17:23 [[32mINFO[0m] __main__:   magnetometer: 20 samples collected
05:17:23 [[32mINFO[0m] __main__: Network sensors stopped for phone_1
05:17:23 [[32mINFO[0m] __main__: Network sensors stopped for phone_2
05:17:23 [[32mINFO[0m] __main__: ✅ Network sensor test: 80 total samples from 4 sensor types
05:17:23 [[32mINFO[0m] __main__: Network Sensors: ✅ PASS
05:17:23 [[32mINFO[0m] __main__: 
--- Running Port Assignments Test ---
05:17:23 [[32mINFO[0m] __main__: Port Assignments: ✅ PASS
05:17:23 [[32mINFO[0m] __main__: 
--- Running Synchronization Test ---
05:17:23 [[32mINFO[0m] __main__: Synchronization: ✅ PASS
05:17:23 [[32mINFO[0m] __main__: ================================================================================
05:17:23 [[32mINFO[0m] __main__: ✅ HARDWARE SENSOR SIMULATION TEST - SUCCESS
05:17:23 [[32mINFO[0m] __main__: Tests Passed: 7/7 (100.0%)
05:17:23 [[32mINFO[0m] __main__: Duration: 6.10 seconds
05:17:23 [[32mINFO[0m] __main__: Data Samples: 220 (36.1/sec)
05:17:23 [[32mINFO[0m] __main__: ================================================================================

======================================================================
🔬 HARDWARE SENSOR SIMULATION TEST SUMMARY
======================================================================
🎉 RESULT: SUCCESS ✅
📊 PERFORMANCE:
  Tests Passed: 7/7
  Success Rate: 100.0%
  Duration: 6.10 seconds
  Data Samples: 220 (36.1/sec)

🔍 SENSOR DETECTION:
  USB Cameras: 0 real, 2 simulated
  Bluetooth: 0 real, 2 simulated
  Thermal: 0 real, 1 simulated
  Network: 2 simulated

📡 DATA COLLECTION:
  usb_camera: 20 samples
  bluetooth_gsr: 100 samples
  thermal_camera: 20 samples
  network_camera: 20 samples
  network_accelerometer: 20 samples
  network_gyroscope: 20 samples
  network_magnetometer: 20 samples

🔌 PORT ASSIGNMENTS:
  Correct: 5/5 (100.0%)

⏱️  SYNCHRONIZATION:
  Quality: Good
  Max Drift: 3.30ms
======================================================================
05:17:23 [[32mINFO[0m] __main__: Test results saved to: /tmp/sensor_test_hz29tsem/sensor_test_results.json

=== STDERR ===
